{
  "schema": "aiops.task_cleanup_receipt.v1",
  "task_id": "T-20260814-001",
  "actor": "Completion Agent",
  "canonical": {
    "ref": "origin/main",
    "sha": "0000000000000000000000000000000000000000"
  },
  "branch": {
    "name": "task/T-20260814-001-example",
    "remote": "origin"
  },
  "worktree_path": null,
  "merge_evidence": {
    "method": "already_clean",
    "verified": true
  },
  "actions": [],
  "result": "complete",
  "blockers": [],
  "created_at": "2026-08-14T00:00:00Z",
  "updated_at": "2026-08-14T00:00:00Z"
}
